{
  "case_id": "X3_UNIFIED_CANDIDATE_20261008_051958_574121_X3_0008_09_05001_N2_V3",
  "directed_links": [
    {
      "destination_node_id": 1,
      "link_id": 0,
      "source_node_id": 0
    },
    {
      "destination_node_id": 0,
      "link_id": 1,
      "source_node_id": 1
    },
    {
      "destination_node_id": 4,
      "link_id": 2,
      "source_node_id": 0
    },
    {
      "destination_node_id": 0,
      "link_id": 3,
      "source_node_id": 4
    },
    {
      "destination_node_id": 2,
      "link_id": 4,
      "source_node_id": 1
    },
    {
      "destination_node_id": 1,
      "link_id": 5,
      "source_node_id": 2
    },
    {
      "destination_node_id": 3,
      "link_id": 6,
      "source_node_id": 2
    },
    {
      "destination_node_id": 2,
      "link_id": 7,
      "source_node_id": 3
    },
    {
      "destination_node_id": 4,
      "link_id": 8,
      "source_node_id": 3
    },
    {
      "destination_node_id": 3,
      "link_id": 9,
      "source_node_id": 4
    },
    {
      "destination_node_id": 6,
      "link_id": 10,
      "source_node_id": 3
    },
    {
      "destination_node_id": 3,
      "link_id": 11,
      "source_node_id": 6
    },
    {
      "destination_node_id": 5,
      "link_id": 12,
      "source_node_id": 4
    },
    {
      "destination_node_id": 4,
      "link_id": 13,
      "source_node_id": 5
    },
    {
      "destination_node_id": 6,
      "link_id": 14,
      "source_node_id": 4
    },
    {
      "destination_node_id": 4,
      "link_id": 15,
      "source_node_id": 6
    },
    {
      "destination_node_id": 6,
      "link_id": 16,
      "source_node_id": 5
    },
    {
      "destination_node_id": 5,
      "link_id": 17,
      "source_node_id": 6
    },
    {
      "destination_node_id": 7,
      "link_id": 18,
      "source_node_id": 6
    },
    {
      "destination_node_id": 6,
      "link_id": 19,
      "source_node_id": 7
    },
    {
      "destination_node_id": 8,
      "link_id": 20,
      "source_node_id": 6
    },
    {
      "destination_node_id": 6,
      "link_id": 21,
      "source_node_id": 8
    },
    {
      "destination_node_id": 8,
      "link_id": 22,
      "source_node_id": 7
    },
    {
      "destination_node_id": 7,
      "link_id": 23,
      "source_node_id": 8
    }
  ],
  "link_spectrum_states": [
    {
      "link_id": 0,
      "slot_availability": [
        0,
        0,
        0,
        0,
        0,
        0,
        0,
        0,
        0,
        0,
        0,
        0,
        1,
        1,
        0,
        0,
        0,
        0,
        0,
        0,
        0,
        0,
        0,
        0,
        1,
        1,
        0,
        0,
        1,
        1,
        1,
        1,
        0,
        0,
        0,
        1,
        1,
        0,
        0,
        0,
        0,
        0,
        0,
        1,
        1,
        1,
        1,
        1,
        1,
        1,
        1,
        1,
        1,
        1,
        1,
        1,
        1,
        1,
        1,
        0,
        0,
        0,
        0,
        0,
        0,
        0,
        0,
        0,
        0,
        1,
        1,
        1,
        1,
        1,
        1,
        1,
        0,
        0,
        0,
        0,
        0,
        1,
        1,
        0,
        0,
        0,
        1,
        1,
        1,
        0,
        0,
        0,
        0,
        0,
        0,
        0,
        0,
        0,
        0,
        1,
        1,
        1,
        1,
        0,
        0,
        0,
        0,
        0,
        0,
        0,
        0,
        0,
        1,
        1,
        1,
        1,
        1,
        1,
        1,
        1,
        1,
        1,
        0,
        0,
        0,
        0,
        0,
        0,
        0,
        0,
        0,
        0,
        0,
        0,
        0,
        0,
        0,
        0,
        0,
        0,
        0,
        0,
        0,
        0,
        0,
        0,
        0,
        0,
        0,
        0,
        0,
        0,
        0,
        0,
        0,
        0,
        0,
        1,
        1,
        1,
        0,
        0,
        0,
        1,
        1,
        1,
        0,
        0,
        0,
        0,
        0,
        0,
        0,
        0,
        0,
        0,
        0,
        0,
        0,
        0,
        0,
        0,
        0,
        0,
        1,
        1,
        1,
        1,
        1,
        1,
        1,
        1,
        0,
        0,
        0,
        0,
        0,
        1,
        1,
        1,
        1,
        1,
        1,
        0,
        0,
        0,
        0,
        0,
        0,
        0,
        0,
        0,
        1,
        1,
        1,
        1,
        1,
        1,
        1,
        1,
        1,
        0,
        0,
        0,
        0,
        0,
        0,
        0,
        0,
        0,
        1,
        1,
        1,
        1,
        1,
        1,
        1,
        1,
        1,
        1,
        1,
        1,
        1,
        1,
        1,
        0,
        0,
        0,
        0,
        0,
        0,
        0,
        0,
        0,
        0,
        0,
        0,
        0,
        0,
        0,
        0,
        0,
        0,
        0,
        0,
        0,
        1,
        1,
        1,
        1,
        1,
        1,
        1,
        1,
        1,
        1,
        1,
        1,
        1,
        1,
        1,
        1,
        1,
        1,
        1,
        1,
        1,
        1,
        1,
        1,
        1,
        1,
        1,
        1,
        1,
        1,
        1,
        1,
        1,
        1,
        1,
        1,
        1,
        1,
        1,
        1,
        1,
        1,
        1,
        1,
        1,
        1,
        0,
        0,
        0,
        0,
        0,
        1,
        1,
        1
      ]
    },
    {
      "link_id": 1,
      "slot_availability": [
        0,
        0,
        0,
        0,
        1,
        1,
        0,
        0,
        0,
        0,
        0,
        0,
        0,
        0,
        0,
        0,
        0,
        0,
        0,
        0,
        0,
        1,
        1,
        1,
        1,
        0,
        0,
        0,
        0,
        0,
        0,
        0,
        0,
        1,
        0,
        0,
        1,
        0,
        0,
        0,
        0,
        0,
        1,
        0,
        0,
        1,
        1,
        0,
        0,
        1,
        1,
        1,
        0,
        0,
        0,
        0,
        0,
        0,
        0,
        0,
        1,
        1,
        1,
        1,
        1,
        1,
        1,
        1,
        0,
        0,
        0,
        0,
        0,
        1,
        0,
        0,
        0,
        1,
        1,
        1,
        1,
        1,
        1,
        1,
        1,
        1,
        0,
        0,
        0,
        1,
        1,
        0,
        0,
        0,
        0,
        0,
        0,
        0,
        0,
        0,
        0,
        0,
        0,
        1,
        1,
        1,
        1,
        1,
        1,
        0,
        0,
        0,
        0,
        0,
        0,
        0,
        0,
        0,
        0,
        0,
        0,
        0,
        0,
        0,
        1,
        0,
        0,
        0,
        0,
        0,
        0,
        0,
        0,
        0,
        0,
        0,
        0,
        0,
        0,
        0,
        0,
        0,
        0,
        1,
        1,
        1,
        1,
        1,
        1,
        1,
        1,
        1,
        1,
        1,
        1,
        1,
        1,
        1,
        1,
        1,
        1,
        1,
        1,
        1,
        1,
        1,
        1,
        0,
        0,
        0,
        1,
        1,
        1,
        1,
        1,
        1,
        1,
        1,
        1,
        1,
        1,
        1,
        1,
        1,
        1,
        1,
        1,
        1,
        1,
        1,
        1,
        1,
        1,
        1,
        1,
        1,
        1,
        1,
        1,
        1,
        1,
        1,
        1,
        1,
        1,
        1,
        1,
        1,
        1,
        1,
        1,
        1,
        1,
        1,
        1,
        0,
        0,
        1,
        1,
        1,
        1,
        1,
        1,
        1,
        1,
        1,
        1,
        1,
        1,
        1,
        1,
        1,
        1,
        1,
        1,
        0,
        0,
        0,
        0,
        0,
        1,
        1,
        1,
        1,
        1,
        1,
        1,
        1,
        1,
        1,
        1,
        1,
        1,
        1,
        1,
        1,
        1,
        1,
        1,
        1,
        1,
        1,
        1,
        1,
        1,
        1,
        0,
        0,
        0,
        0,
        0,
        0,
        0,
        0,
        0,
        1,
        1,
        1,
        1,
        1,
        1,
        1,
        1,
        1,
        1,
        1,
        1,
        1,
        1,
        1,
        1,
        1,
        1,
        1,
        1,
        1,
        1,
        1,
        1,
        1,
        1,
        1,
        1,
        1,
        1,
        1,
        1,
        1,
        1,
        1,
        1,
        1,
        1,
        1,
        1,
        1,
        0,
        0,
        0,
        1
      ]
    },
    {
      "link_id": 2,
      "slot_availability": [
        0,
        0,
        0,
        0,
        0,
        0,
        0,
        1,
        0,
        0,
        0,
        0,
        0,
        0,
        1,
        1,
        0,
        0,
        0,
        0,
        0,
        0,
        0,
        0,
        0,
        0,
        0,
        0,
        0,
        1,
        1,
        0,
        0,
        1,
        0,
        0,
        0,
        0,
        0,